{
    "$schema": "http://json-schema.org/draft-07/schema#",
    "$id": "https://github.com/Cyber-Syntax/my-unicorn/schemas/catalog_v1.schema.json",
    "title": "My Unicorn Catalog Configuration v1",
    "description": "JSON Schema for v1 catalog configuration files that define AppImage metadata",
    "type": "object",
    "required": [
        "owner",
        "repo",
        "appimage",
        "github",
        "verification",
        "icon"
    ],
    "properties": {
        "owner": {
            "type": "string",
            "description": "GitHub repository owner/organization",
            "minLength": 1
        },
        "repo": {
            "type": "string",
            "description": "GitHub repository name",
            "minLength": 1
        },
        "appimage": {
            "type": "object",
            "required": [
                "rename",
                "name_template",
                "characteristic_suffix"
            ],
            "properties": {
                "rename": {
                    "type": "string",
                    "description": "Target name for the AppImage",
                    "minLength": 1
                },
                "name_template": {
                    "type": "string",
                    "description": "Template for AppImage filename",
                    "minLength": 1
                },
                "characteristic_suffix": {
                    "type": "array",
                    "description": "Architecture or variant suffixes",
                    "items": {
                        "type": "string"
                    }
                }
            },
            "additionalProperties": false
        },
        "github": {
            "type": "object",
            "required": [
                "repo",
                "prerelease"
            ],
            "properties": {
                "repo": {
                    "type": "boolean",
                    "description": "Whether this is a GitHub repository release"
                },
                "prerelease": {
                    "type": "boolean",
                    "description": "Whether to include pre-release versions"
                }
            },
            "additionalProperties": false
        },
        "verification": {
            "type": "object",
            "required": [
                "digest",
                "skip",
                "checksum_file",
                "checksum_hash_type"
            ],
            "properties": {
                "digest": {
                    "type": "boolean",
                    "description": "Whether to verify using GitHub API provided digest"
                },
                "skip": {
                    "type": "boolean",
                    "description": "Whether to skip verification entirely"
                },
                "checksum_file": {
                    "type": "string",
                    "description": "Filename of checksum file (empty string if not used)"
                },
                "checksum_hash_type": {
                    "type": "string",
                    "enum": [
                        "sha256",
                        "sha512"
                    ],
                    "description": "Hash algorithm for checksum verification"
                }
            },
            "additionalProperties": false
        },
        "icon": {
            "type": "object",
            "required": [
                "extraction",
                "url",
                "name"
            ],
            "properties": {
                "extraction": {
                    "type": "boolean",
                    "description": "Whether to extract icon from AppImage"
                },
                "url": {
                    "type": [
                        "string",
                        "null"
                    ],
                    "description": "URL to download icon from (empty string or null if not used)"
                },
                "name": {
                    "type": "string",
                    "description": "Filename for the icon",
                    "minLength": 1
                }
            },
            "additionalProperties": false
        }
    },
    "additionalProperties": false
}