{
    "owner": "zen-browser",
    "repo": "desktop",
    "appimage": {
        "rename": "zen-browser",
        "name_template": "zen-{characteristic_suffix}.AppImage",
        "characteristic_suffix": [
            "x86_64",
            "amd64"
        ]
    },
    "github": {
        "repo": true,
        "prerelease": false
    },
    "verification": {
        "digest": true,
        "skip": false,
        "checksum_file": "",
        "checksum_hash_type": "sha256"
    },
    "icon": {
        "extraction": true,
        "url": "https://raw.githubusercontent.com/zen-browser/desktop/dev/docs/assets/zen-black.svg",
        "name": "zen-browser.svg"
    }
}