{
    "owner": "keepassxreboot",
    "repo": "keepassxc",
    "appimage": {
        "rename": "keepassxc",
        "name_template": "",
        "characteristic_suffix": []
    },
    "github": {
        "repo": true,
        "prerelease": false
    },
    "verification": {
        "digest": false,
        "skip": false,
        "checksum_file": "KeePassXC-2.7.10-x86_64.AppImage.DIGEST",
        "checksum_hash_type": "sha256"
    },
    "icon": {
        "extraction": true,
        "url": "",
        "name": "keepassxc.png"
    }
}
