{
    "owner": "endless-sky",
    "repo": "endless-sky",
    "appimage": {
        "rename": "endless-sky",
        "name_template": "{repo}-{characteristic_suffix}.AppImage",
        "characteristic_suffix": ["x86_64.AppImage"]
    },
    "github": {
        "repo": true,
        "prerelease": false
    },
    "verification": {
        "digest": true,
        "skip": false,
        "checksum_file": "",
        "checksum_hash_type": "sha256"
    },
    "icon": {
        "extraction": true,
        "url": "",
        "name": "endless-sky.png"
    }
}
