{
    "owner": "Legcord",
    "repo": "Legcord",
    "appimage": {
        "rename": "legcord",
        "name_template": "",
        "characteristic_suffix": []
    },
    "github": {
        "repo": true,
        "prerelease": false
    },
    "verification": {
        "digest": false,
        "skip": false,
        "checksum_file": "latest-linux.yml",
        "checksum_hash_type": "sha256"
    },
    "icon": {
        "extraction": true,
        "url": "",
        "name": "legcord.png"
    }
}
