{
  "owner": "neovim",
  "repo": "neovim",
  "appimage": {
    "rename": "neovim",
    "name_template": "",
    "characteristic_suffix": []
  },
  "github": {
    "repo": true,
    "prerelease": false
  },
  "verification": {
    "digest": true,
    "skip": false,
    "checksum_file": "",
    "checksum_hash_type": "sha256"
  },
  "icon": {
    "extraction": true,
    "url": "",
    "name": "neovim.png"
  }
}