{
    "owner": "FreeTubeApp",
    "repo": "FreeTube",
    "appimage": {
        "rename": "freetube",
        "name_template": "{rename}-{latest_version}-{characteristic_suffix}.AppImage",
        "characteristic_suffix": ["amd64", "x86_64"]
    },
    "github": {
        "repo": true,
        "prerelease": true
    },
    "verification": {
        "digest": false,
        "skip": true,
        "checksum_file": "",
        "checksum_hash_type": "sha256"
    },
    "icon": {
        "extraction": true,
        "url": "https://raw.githubusercontent.com/FreeTubeApp/FreeTube/development/_icons/icon.svg",
        "name": "freetube.svg"
    }
}
