{
    "owner": "FreeCAD",
    "repo": "FreeCAD",
    "appimage": {
        "rename": "freecad",
        "name_template": "",
        "characteristic_suffix": []
    },
    "github": {
        "repo": true,
        "prerelease": false
    },
    "verification": {
        "digest": true,
        "skip": false,
        "checksum_file": "",
        "checksum_hash_type": "sha256"
    },
    "icon": {
        "extraction": true,
        "url": "",
        "name": "freecad.png"
    }
}
