{
    "owner": "obsidianmd",
    "repo": "obsidian-releases",
    "appimage": {
        "rename": "obsidian",
        "name_template": "{rename}-{latest_version}.AppImage",
        "characteristic_suffix": [
            ""
        ]
    },
    "github": {
        "repo": true,
        "prerelease": false
    },
    "verification": {
        "digest": true,
        "skip": false,
        "checksum_file": "",
        "checksum_hash_type": "sha256"
    },
    "icon": {
        "extraction": true,
        "url": "",
        "name": "obsidian.png"
    }
}